{"archiveIdentity":{"principalFingerprint":"aaaaaaaaaaaaaaaaaaaaaaaaaaaaaaaaaaaaaaaaaaaaaaaaaaaaaaaaaaaaaaaa","provider":"S3_COMPATIBLE"},"artifacts":[{"artifactId":"1001","payload":{"protection":{"actualMode":"COMPLIANCE","retainUntil":"2028-09-07T08:00:02Z"},"recoveredSha256":"3eb191fa5a8798f7c77e22162374b7c5c1f624d6a4845bdfeb48b149b3d1e736","recoveredSizeBytes":178,"reference":{"bucket":"test-fixture-evidence","key":"TEST_FIXTURE/identity/1001/payload.zip","locator":"s3://test-fixture-evidence/TEST_FIXTURE/identity/1001/payload.zip","provider":"S3_COMPATIBLE","sha256":"3eb191fa5a8798f7c77e22162374b7c5c1f624d6a4845bdfeb48b149b3d1e736","sizeBytes":178,"versionId":"TEST_FIXTURE-version-1"}},"receipt":{"protection":{"actualMode":"COMPLIANCE","retainUntil":"2028-09-07T08:00:02Z"},"recoveredSha256":"d2e88b70aad65621b6189998c20ea6297b0ce9683037cded1676cda5cc697a93","recoveredSizeBytes":866,"reference":{"bucket":"test-fixture-evidence","key":"TEST_FIXTURE/identity/1001/receipt.json","locator":"s3://test-fixture-evidence/TEST_FIXTURE/identity/1001/receipt.json","provider":"S3_COMPATIBLE","sha256":"d2e88b70aad65621b6189998c20ea6297b0ce9683037cded1676cda5cc697a93","sizeBytes":866,"versionId":"TEST_FIXTURE-version-2"}},"receiptArchivedAt":"2026-09-07T08:00:02Z","sourceCommit":"1111111111111111111111111111111111111111","sourceRunId":"2001"},{"artifactId":"1002","payload":{"protection":{"actualMode":"COMPLIANCE","retainUntil":"2028-09-07T08:00:02Z"},"recoveredSha256":"69ec5da51628c592871be36dc259d26be1288459ef7ad866db24982a3a749f10","recoveredSizeBytes":178,"reference":{"bucket":"test-fixture-evidence","key":"TEST_FIXTURE/identity/1002/payload.zip","locator":"s3://test-fixture-evidence/TEST_FIXTURE/identity/1002/payload.zip","provider":"S3_COMPATIBLE","sha256":"69ec5da51628c592871be36dc259d26be1288459ef7ad866db24982a3a749f10","sizeBytes":178,"versionId":"TEST_FIXTURE-version-3"}},"receipt":{"protection":{"actualMode":"COMPLIANCE","retainUntil":"2028-09-07T08:00:02Z"},"recoveredSha256":"4a333f8dea9b855ae52f89c5016b952e9b2361810ba7b4fbcc21bed7351ab47d","recoveredSizeBytes":866,"reference":{"bucket":"test-fixture-evidence","key":"TEST_FIXTURE/identity/1002/receipt.json","locator":"s3://test-fixture-evidence/TEST_FIXTURE/identity/1002/receipt.json","provider":"S3_COMPATIBLE","sha256":"4a333f8dea9b855ae52f89c5016b952e9b2361810ba7b4fbcc21bed7351ab47d","sizeBytes":866,"versionId":"TEST_FIXTURE-version-4"}},"receiptArchivedAt":"2026-09-07T08:00:02Z","sourceCommit":"2222222222222222222222222222222222222222","sourceRunId":"2002"}],"cleanupErrorCode":null,"cleanupStatus":"PASS","completedAt":"2026-09-07T08:10:00Z","descriptorSha256":"0cae7323326b57385b52a2823179e5c517a9b9e76d0c9e8ccb3bfe30b63228ad","errorCode":null,"executionId":"25250000-0000-4000-8000-000000000001","pilotManifestSha256":"07ab54425da56aee39f70cbb4827bd4462b80519eac1b258776fb0abbcdf5e6d","schemaVersion":2,"startedAt":"2026-09-07T08:10:00Z","status":"PASS","verifierIdentity":{"principalFingerprint":"bbbbbbbbbbbbbbbbbbbbbbbbbbbbbbbbbbbbbbbbbbbbbbbbbbbbbbbbbbbbbbbb","provider":"S3_COMPATIBLE"},"workPackageId":"M2-5-EVIDENCE-ARCHIVE-001"}