{"archiveIdentity":{"principalFingerprint":"bbbbbbbbbbbbbbbbbbbbbbbbbbbbbbbbbbbbbbbbbbbbbbbbbbbbbbbbbbbbbbbb","provider":"S3_COMPATIBLE"},"artifacts":[{"artifactId":"1001","payload":{"protection":{"actualMode":"COMPLIANCE","retainUntil":"2027-08-28T10:15:01Z"},"recoveredSha256":"6666666666666666666666666666666666666666666666666666666666666666","recoveredSizeBytes":101,"reference":{"bucket":"test-fixture-evidence","key":"TEST_FIXTURE/artifact-1001/payload.zip","locator":"s3://test-fixture-evidence/TEST_FIXTURE/artifact-1001/payload.zip","provider":"S3_COMPATIBLE","sha256":"6666666666666666666666666666666666666666666666666666666666666666","sizeBytes":101,"versionId":"TEST_FIXTURE-payload-1001-v1"}},"receipt":{"protection":{"actualMode":"COMPLIANCE","retainUntil":"2027-08-28T10:15:01Z"},"recoveredSha256":"8888888888888888888888888888888888888888888888888888888888888888","recoveredSizeBytes":501,"reference":{"bucket":"test-fixture-evidence","key":"TEST_FIXTURE/artifact-1001/receipt.json","locator":"s3://test-fixture-evidence/TEST_FIXTURE/artifact-1001/receipt.json","provider":"S3_COMPATIBLE","sha256":"8888888888888888888888888888888888888888888888888888888888888888","sizeBytes":501,"versionId":"TEST_FIXTURE-receipt-1001-v1"}},"receiptArchivedAt":"2026-08-27T10:03:00Z","sourceCommit":"4444444444444444444444444444444444444444","sourceRunId":"9001"},{"artifactId":"1002","payload":{"protection":{"actualMode":"COMPLIANCE","retainUntil":"2027-08-28T10:15:01Z"},"recoveredSha256":"7777777777777777777777777777777777777777777777777777777777777777","recoveredSizeBytes":202,"reference":{"bucket":"test-fixture-evidence","key":"TEST_FIXTURE/artifact-1002/payload.zip","locator":"s3://test-fixture-evidence/TEST_FIXTURE/artifact-1002/payload.zip","provider":"S3_COMPATIBLE","sha256":"7777777777777777777777777777777777777777777777777777777777777777","sizeBytes":202,"versionId":"TEST_FIXTURE-payload-1002-v1"}},"receipt":{"protection":{"actualMode":"COMPLIANCE","retainUntil":"2027-08-28T10:15:01Z"},"recoveredSha256":"9999999999999999999999999999999999999999999999999999999999999999","recoveredSizeBytes":502,"reference":{"bucket":"test-fixture-evidence","key":"TEST_FIXTURE/artifact-1002/receipt.json","locator":"s3://test-fixture-evidence/TEST_FIXTURE/artifact-1002/receipt.json","provider":"S3_COMPATIBLE","sha256":"9999999999999999999999999999999999999999999999999999999999999999","sizeBytes":502,"versionId":"TEST_FIXTURE-receipt-1002-v1"}},"receiptArchivedAt":"2026-08-27T10:04:00Z","sourceCommit":"5555555555555555555555555555555555555555","sourceRunId":"9002"}],"cleanupErrorCode":null,"cleanupStatus":"PASS","completedAt":"2026-08-27T10:15:00Z","descriptorSha256":"5b4b499a0271b7524a8ba0b0f06a32297dae54b356f6f498ba3a72d79e013a39","errorCode":null,"executionId":"aaaaaaaa-bbbb-4ccc-8ddd-eeeeeeeeeeee","pilotManifestSha256":"3333333333333333333333333333333333333333333333333333333333333333","schemaVersion":1,"startedAt":"2026-08-27T10:10:00Z","status":"PASS","verifierIdentity":{"principalFingerprint":"cccccccccccccccccccccccccccccccccccccccccccccccccccccccccccccccc","provider":"S3_COMPATIBLE"},"workPackageId":"V0-2-EVIDENCE-ARCHIVE-001"}